<?xml version="1.0"?>
<xs:schema xmlns:xs="http://www.w3.org/2001/XMLSchema">

    <xs:complexType name="simulation_t">
        <xs:sequence>
            <xs:element name="end_time" type="xs:double" maxOccurs="1" minOccurs="1"/>
            <xs:element name="delta_t" type="xs:double" maxOccurs="1" minOccurs="1"/>
            <xs:element name="sigma" type="xs:double" maxOccurs="1" minOccurs="1"/>
            <xs:element name="epsilon" type="xs:double" maxOccurs="1" minOccurs="1"/>
            <xs:element name="cutoff" type="xs:double" maxOccurs="1" minOccurs="1"/>
            <xs:element name="file_name" type="xs:string" maxOccurs="unbounded" minOccurs="0"/>
            <xs:element name="domain">
                <xs:complexType >
                    <xs:sequence>
                        <xs:element name="d1" type="xs:double" maxOccurs="1" minOccurs="1"/>
                        <xs:element name="d2" type="xs:double" maxOccurs="1" minOccurs="1"/>
                        <xs:element name="d3" type="xs:double" maxOccurs="1" minOccurs="1"/>
                    </xs:sequence>
                </xs:complexType>
            </xs:element>
            <xs:element name="cuboid" maxOccurs="unbounded" minOccurs="0">
                <xs:complexType>
                    <xs:sequence>
                        <xs:element name="mass" type="xs:double" maxOccurs="1" minOccurs="1"/>
                        <xs:element name="h" type="xs:double" maxOccurs="1" minOccurs="1"/>
                        <xs:element name="meanV" type="xs:double" maxOccurs="1" minOccurs="1"/>
                        <xs:element name="type" type="xs:int" maxOccurs="1" minOccurs="1"/>
                        <xs:element name="position">
                            <xs:complexType>
                                <xs:sequence>
                                    <xs:element name="x" type="xs:double" maxOccurs="1" minOccurs="1"/>
                                    <xs:element name="y" type="xs:double" maxOccurs="1" minOccurs="1"/>
                                    <xs:element name="z" type="xs:double" maxOccurs="1" minOccurs="1"/>
                                </xs:sequence>
                            </xs:complexType>
                        </xs:element>
                        <xs:element name="velocity">
                            <xs:complexType>
                                <xs:sequence>
                                    <xs:element name="x" type="xs:double" maxOccurs="1" minOccurs="1"/>
                                    <xs:element name="y" type="xs:double" maxOccurs="1" minOccurs="1"/>
                                    <xs:element name="z" type="xs:double" maxOccurs="1" minOccurs="1"/>
                                </xs:sequence>
                            </xs:complexType>
                        </xs:element>
                        <xs:element name="dimensions">
                            <xs:complexType>
                                <xs:sequence>
                                    <xs:element name="x" type="xs:int" maxOccurs="1" minOccurs="1"/>
                                    <xs:element name="y" type="xs:int" maxOccurs="1" minOccurs="1"/>
                                    <xs:element name="z" type="xs:int" maxOccurs="1" minOccurs="1"/>
                                </xs:sequence>
                            </xs:complexType>
                        </xs:element>
                    </xs:sequence>
                </xs:complexType>
            </xs:element>
            <xs:element name="sphere" maxOccurs="unbounded" minOccurs="0">
                <xs:complexType>
                    <xs:sequence>
                        <xs:element name="mass" type="xs:double" maxOccurs="1" minOccurs="1"/>
                        <xs:element name="h" type="xs:double" maxOccurs="1" minOccurs="1"/>
                        <xs:element name="meanV" type="xs:double" maxOccurs="1" minOccurs="1"/>
                        <xs:element name="type" type="xs:int" maxOccurs="1" minOccurs="1"/>
                        <xs:element name="r" type="xs:int" maxOccurs="1" minOccurs="1"/>                            
                        <xs:element name="center">
                            <xs:complexType>
                                <xs:sequence>
                                    <xs:element name="x" type="xs:double" maxOccurs="1" minOccurs="1"/>
                                    <xs:element name="y" type="xs:double" maxOccurs="1" minOccurs="1"/>
                                    <xs:element name="z" type="xs:double" maxOccurs="1" minOccurs="1"/>
                                </xs:sequence>
                            </xs:complexType>
                        </xs:element>
                        <xs:element name="velocity">
                            <xs:complexType>
                                <xs:sequence>
                                    <xs:element name="x" type="xs:double" maxOccurs="1" minOccurs="1"/>
                                    <xs:element name="y" type="xs:double" maxOccurs="1" minOccurs="1"/>
                                    <xs:element name="z" type="xs:double" maxOccurs="1" minOccurs="1"/>
                                </xs:sequence>
                            </xs:complexType>
                        </xs:element>
                    </xs:sequence>
                </xs:complexType>
            </xs:element>
        </xs:sequence>
    </xs:complexType>
    <xs:element name="simulation" type="simulation_t"/>
</xs:schema>