<?xml version="1.0"?>
<simulation xmlns:xsi="http://www.w3.org/2001/XMLSchema-instance"
       xsi:noNamespaceSchemaLocation="../src/xsd/Simulation.xsd">
    <end_time>0.0005</end_time>
    <delta_t>0.00005</delta_t>
    <sigma>1</sigma> 
    <epsilon>5</epsilon>
    <cutoff>3.0</cutoff>
    <domain>
        <x>150</x>
        <y>80</y>
        <z>0</z>
    </domain>
    <boundaries>
        <xLeft>Reflecting</xLeft>
        <xRight>Reflecting</xRight>
        <yBottom>Reflecting</yBottom>
        <yTop>Reflecting</yTop>
        <zFront>Reflecting</zFront>
        <zBack>Reflecting</zBack>
    </boundaries>
    <writeFrequency>10</writeFrequency>
    <baseName>outputVTK/</baseName>
    <cuboid>
        <mass>1.0</mass>
        <h>1.1225</h>
        <meanV>0.1</meanV>
        <type>1</type>
        <position>
            <x>20</x>
            <y>20</y>
            <z>0</z>
        </position>
        <velocity>
            <x>0</x>
            <y>0</y>
            <z>0</z>
        </velocity>
        <dimensions>
            <x>100</x>
            <y>20</y>
            <z>1</z>
        </dimensions>
    </cuboid>
    <sphere>
        <mass>1.0</mass>
        <h>1.1225</h>
        <meanV>0.1</meanV>
        <type>1</type>
        <r>15</r>
        <center>
            <x>25</x>
            <y>20</y>
            <z>0</z>
        </center>
        <velocity>
            <x>0</x>
            <y>0</y>
            <z>0</z>
        </velocity>
    </sphere>
</simulation>